### ISSUE TITLE
Intermittent connection reset and delay running time

### ISSUE THREAD

**Issue by younsl** [aws/amazon-vpc-cni-k8s#2871]
**What happened**:

After migrating the network policy provider from Calico with Tigera Operator to VPC CNI, the following 2 pod network issues occurred on EKS v1.26 cluster:

> **Note**:
> The two network issues mentioned in this issue only occur in pods that have applied NetworkPolicy via VPC CNI.

### Cluster environment

- EKS v1.26
- **Kernel** : 5.10.205-195.804.amzn2.x86_64
- VPC CNI v1.18.0-eksbuild.1

#### 1. Intermittent connection reset by peer

occurs during Pod to Pod or Pod to EC2 communication.

Similar issues: https://github.com/aws/aws-network-policy-agent/issues/204, https://github.com/aws/aws-network-policy-agent/issues/210

#### 2. Delayed Running time
 
Delay in the time it takes for the pod to run.

<img width="692" alt="image" src="https://github.com/aws/amazon-vpc-cni-k8s/assets/87736192/c099dbdd-30fb-4e3d-9b51-8272cdb513bd">

| Category | 1st time | 2nd time |
|----------|---------|-----------|
| egress netpol applied | 86s | 91s |
| egress netpol not applied | 30s | 32s |

Similar issues: https://github.com/aws/aws-network-policy-agent/issues/189, https://github.com/aws/aws-network-policy-agent/issues/186

**Attach logs**

### 1. Intermittent connection reset by peer

[tcpdump] From workload pod to EC2 instance

```bash
$ tcpdump -i any '(dst host xx.xxx.xxx.247 and dst port 8080) or (tcp[tcpflags] & tcp-rst != 0)'
tcpdump: data link type LINUX_SLL2
tcpdump: verbose output suppressed, use -v[v]... for full protocol decode
listening on any, link-type LINUX_SLL2 (Linux cooked v2), snapshot length 262144 bytes

07:40:05.607233 eth0  Out IP <REDACTED>-5bc847767c-56l5j.47664 > ip-xx-xxx-xxx-247.ap-northeast-2.compute.internal.8080: Flags [S], seq 4216205005, win 62727, options [mss 8961,sackOK,TS val 896125324 ecr 0,nop,wscale 7], length 0
07:40:05.607607 eth0  In  IP ip-xx-xxx-xxx-247.ap-northeast-2.compute.internal.8080 > <REDACTED>-5bc847767c-56l5j.47664: Flags [R.], seq 0, ack 4216205006, win 0, length 0

... repeated ...

07:42:25.807039 eth0  Out IP <REDACTED>-5bc847767c-56l5j.39080 > ip-xx-xxx-xxx-247.ap-northeast-2.compute.internal.8080: Flags [S], seq 1628133200, win 62727, options [mss 8961,sackOK,TS val 896265524 ecr 0,nop,wscale 7], length 0
07:42:25.807463 eth0  In  IP ip-xx-xxx-xxx-247.ap-northeast-2.compute.internal.8080 > <REDACTED>-5bc847767c-56l5j.39080: Flags [R.], seq 0, ack 1628133201, win 0, length 0
```

Intermittently, the workload pod receives a reset<sup>RST</sup> packet response from EC2.

[kubectl sniff] From workload pod to EC2 instance

```bash
# Source IP started with 221 is workload pod
# Destination IP ended with 247 is EC2 instance.
INFO[0000] executing command: '[/tmp/static-tcpdump -i any -U -w - port 8080]' on container: '<REDACTED>', pod: '<REDACTED>-5bc847767c-56l5j', namespace: 'b<REDACTED>'
    1   0.000000 xx.xxx.xxx.221 → yy.yyy.yyy.247 TCP 76 53456 → 8080 [SYN] Seq=0 Win=62727 Len=0 MSS=8961 SACK_PERM TSval=897677821 TSecr=0 WS=128
    2   0.000433 yy.yyy.yyy.247 → xx.xxx.xxx.221 TCP 56 8080 → 53456 [RST, ACK] Seq=1 Ack=1 Win=0 Len=0
    3  70.178815 xx.xxx.xxx.221 → yy.yyy.yyy.247 TCP 76 33610 → 8080 [SYN] Seq=0 Win=62727 Len=0 MSS=8961 SACK_PERM TSval=897748000 TSecr=0 WS=128
    4  70.179236 yy.yyy.yyy.247 → xx.xxx.xxx.221 TCP 56 8080 → 33610 [RST, ACK] Seq=1 Ack=1 Win=0 Len=0
    5 140.194787 xx.xxx.xxx.221 → yy.yyy.yyy.247 TCP 76 51794 → 8080 [SYN] Seq=0 Win=62727 Len=0 MSS=8961 SACK_PERM TSval=897818016 TSecr=0 WS=128
    6 140.195225 yy.yyy.yyy.247 → xx.xxx.xxx.221 TCP 56 8080 → 51794 [RST, ACK] Seq=1 Ack=1 Win=0 Len=0
    7 210.383682 xx.xxx.xxx.221 → yy.yyy.yyy.247 TCP 76 32906 → 8080 [SYN] Seq=0 Win=62727 Len=0 MSS=8961 SACK_PERM TSval=897888204 TSecr=0 WS=128
    8 210.384104 yy.yyy.yyy.247 → xx.xxx.xxx.221 TCP 56 8080 → 32906 [RST, ACK] Seq=1 Ack=1 Win=0 Len=0
    9 280.399946 xx.xxx.xxx.221 → yy.yyy.yyy.247 TCP 76 55182 → 8080 [SYN] Seq=0 Win=62727 Len=0 MSS=8961 SACK_PERM TSval=897958221 TSecr=0 WS=128
   10 280.400365 yy.yyy.yyy.247 → xx.xxx.xxx.221 TCP 56 8080 → 55182 [RST, ACK] Seq=1 Ack=1 Win=0 Len=0
   11 351.055956 xx.xxx.xxx.221 → yy.yyy.yyy.247 TCP 76 42620 → 8080 [SYN] Seq=0 Win=62727 Len=0 MSS=8961 SACK_PERM TSval=898028877 TSecr=0 WS=128
   12 351.056403 yy.yyy.yyy.247 → xx.xxx.xxx.221 TCP 56 8080 → 42620 [RST, ACK] Seq=1 Ack=1 Win=0 Len=0
   13 421.076549 xx.xxx.xxx.221 → yy.yyy.yyy.247 TCP 76 49318 → 8080 [SYN] Seq=0 Win=62727 Len=0 MSS=8961 SACK_PERM TSval=898098897 TSecr=0 WS=128
   14 421.076943 yy.yyy.yyy.247 → xx.xxx.xxx.221 TCP 56 8080 → 49318 [RST, ACK] Seq=1 Ack=1 Win=0 Len=0
   15 495.679313 xx.xxx.xxx.221 → yy.yyy.yyy.247 TCP 76 45716 → 8080 [SYN] Seq=0 Win=62727 Len=0 MSS=8961 SACK_PERM TSval=898173500 TSecr=0 WS=128
   16 495.679744 yy.yyy.yyy.247 → xx.xxx.xxx.221 TCP 56 8080 → 45716 [RST, ACK] Seq=1 Ack=1 Win=0 Len=0
   17 565.699845 xx.xxx.xxx.221 → yy.yyy.yyy.247 TCP 76 46792 → 8080 [SYN] Seq=0 Win=62727 Len=0 MSS=8961 SACK_PERM TSval=898243521 TSecr=0 WS=128
   18 565.700281 yy.yyy.yyy.247 → xx.xxx.xxx.221 TCP 56 8080 → 46792 [RST, ACK] Seq=1 Ack=1 Win=0 Len=0
```

intermittently, the workload pod receives a reset<sup>RST</sup> packet response from EC2.

If a issue occurs in the workload pod, the slack notification below is output.

![image](https://github.com/aws/amazon-vpc-cni-k8s/assets/87736192/d831a64a-c005-47e0-a8a4-392e2fb3c463)

### 2. Delayed Running time

 ebpf-sdk log checked on worker node immediately after pod restart
```bash
$ tail -f ebpf-sdk.log | grep 'xx.xxx.xx.117'
{"level":"info","ts":"2024-04-11T02:25:29.435Z","caller":"ebpf/bpf_client.go:724","msg":"Converted string to bytearray [32 0 0 0 xx xxx xx 117]"}
{"level":"info","ts":"2024-04-11T02:25:29.437Z","caller":"maps/loader.go:491","msg":"Adding to key list [32 0 0 0 xx xxx xx 117]"}
{"level":"info","ts":"2024-04-11T02:25:29.584Z","caller":"ebpf/bpf_client.go:724","msg":"Converted string to bytearray [32 0 0 0 xx xxx xx 117]"}
{"level":"info","ts":"2024-04-11T02:25:29.586Z","caller":"maps/loader.go:491","msg":"Adding to key list [32 0 0 0 xx xxx xx 117]"}
{"level":"info","ts":"2024-04-11T02:25:29.750Z","caller":"ebpf/bpf_client.go:724","msg":"Converted string to bytearray [32 0 0 0 xx xxx xx 117]"}
{"level":"info","ts":"2024-04-11T02:25:29.752Z","caller":"maps/loader.go:491","msg":"Adding to key list [32 0 0 0 xx xxx xx 117]"}
{"level":"info","ts":"2024-04-11T02:25:29.888Z","caller":"ebpf/bpf_client.go:724","msg":"Converted string to bytearray [32 0 0 0 xx xxx xx 117]"}
{"level":"info","ts":"2024-04-11T02:25:29.890Z","caller":"maps/loader.go:491","msg":"Adding to key list [32 0 0 0 xx xxx xx 117]"}
{"level":"info","ts":"2024-04-11T02:25:30.012Z","caller":"ebpf/bpf_client.go:724","msg":"Converted string to bytearray [32 0 0 0 xx xxx xx 117]"}
{"level":"info","ts":"2024-04-11T02:25:30.014Z","caller":"maps/loader.go:491","msg":"Adding to key list [32 0 0 0 xx xxx xx 117]"}
{"level":"info","ts":"2024-04-11T02:25:30.073Z","caller":"ebpf/bpf_client.go:724","msg":"Converted string to bytearray [32 0 0 0 xx xxx xx 117]"}
{"level":"info","ts":"2024-04-11T02:25:30.074Z","caller":"maps/loader.go:491","msg":"Adding to key list [32 0 0 0 xx xxx xx 117]"}
{"level":"info","ts":"2024-04-11T02:25:48.596Z","caller":"ebpf/bpf_client.go:724","msg":"Converted string to bytearray [32 0 0 0 xx xxx xx 117]"}
{"level":"info","ts":"2024-04-11T02:25:48.598Z","caller":"maps/loader.go:491","msg":"Adding to key list [32 0 0 0 xx xxx xx 117]"}
{"level":"info","ts":"2024-04-11T02:25:48.665Z","caller":"ebpf/bpf_client.go:724","msg":"Converted string to bytearray [32 0 0 0 xx xxx xx 117]"}
{"level":"info","ts":"2024-04-11T02:25:48.667Z","caller":"maps/loader.go:491","msg":"Adding to key list [32 0 0 0 xx xxx xx 117]"}
{"level":"info","ts":"2024-04-11T02:25:48.831Z","caller":"ebpf/bpf_client.go:724","msg":"Converted string to bytearray [32 0 0 0 xx xxx xx 117]"}
{"level":"info","ts":"2024-04-11T02:25:48.832Z","caller":"maps/loader.go:491","msg":"Adding to key list [32 0 0 0 xx xxx xx 117]"}
{"level":"info","ts":"2024-04-11T02:25:48.929Z","caller":"ebpf/bpf_client.go:724","msg":"Converted string to bytearray [32 0 0 0 xx xxx xx 117]"}
{"level":"info","ts":"2024-04-11T02:25:48.931Z","caller":"maps/loader.go:491","msg":"Adding to key list [32 0 0 0 xx xxx xx 117]"}
{"level":"info","ts":"2024-04-11T02:25:49.009Z","caller":"ebpf/bpf_client.go:724","msg":"Converted string to bytearray [32 0 0 0 xx xxx xx 117]"}
{"level":"info","ts":"2024-04-11T02:25:49.010Z","caller":"maps/loader.go:491","msg":"Adding to key list [32 0 0 0 xx xxx xx 117]"}
{"level":"info","ts":"2024-04-11T02:25:49.182Z","caller":"ebpf/bpf_client.go:724","msg":"Converted string to bytearray [32 0 0 0 xx xxx xx 117]"}
{"level":"info","ts":"2024-04-11T02:25:49.185Z","caller":"maps/loader.go:491","msg":"Adding to key list [32 0 0 0 xx xxx xx 117]"}
```

```bash
$ tail -f /var/log/aws-routed-eni/network-policy-agent.log | egrep 'xx.xxx.xxx.198'
{"level":"info","ts":"2024-04-11T02:18:47.938Z","logger":"ebpf-client","msg":"Flow Info:  ","Src IP":"172.20.67.165","Src Port":80,"Dest IP":"xx.xxx.xxx.198","Dest Port":49032,"Proto":"TCP","Verdict":"DENY"}
{"level":"info","ts":"2024-04-11T02:18:49.431Z","logger":"ebpf-client","msg":"Flow Info:  ","Src IP":"xx.xxx.xxx.179","Src Port":45868,"Dest IP":"xx.xxx.xxx.198","Dest Port":3000,"Proto":"TCP","Verdict":"ACCEPT"}
{"level":"info","ts":"2024-04-11T02:18:51.394Z","logger":"ebpf-client","msg":"Flow Info:  ","Src IP":"172.20.67.165","Src Port":80,"Dest IP":"xx.xxx.xxx.198","Dest Port":49032,"Proto":"TCP","Verdict":"DENY"}
{"level":"info","ts":"2024-04-11T02:18:58.054Z","logger":"ebpf-client","msg":"Flow Info:  ","Src IP":"172.20.67.165","Src Port":80,"Dest IP":"xx.xxx.xxx.198","Dest Port":49032,"Proto":"TCP","Verdict":"DENY"}
{"level":"info","ts":"2024-04-11T02:18:59.431Z","logger":"ebpf-client","msg":"Flow Info:  ","Src IP":"xx.xxx.xxx.179","Src Port":41568,"Dest IP":"xx.xxx.xxx.198","Dest Port":3000,"Proto":"TCP","Verdict":"ACCEPT"}
{"level":"info","ts":"2024-04-11T02:19:09.431Z","logger":"ebpf-client","msg":"Flow Info:  ","Src IP":"xx.xxx.xxx.179","Src Port":49904,"Dest IP":"xx.xxx.xxx.198","Dest Port":3000,"Proto":"TCP","Verdict":"ACCEPT"}
{"level":"info","ts":"2024-04-11T02:19:09.431Z","logger":"ebpf-client","msg":"Flow Info:  ","Src IP":"xx.xxx.xxx.179","Src Port":49908,"Dest IP":"xx.xxx.xxx.198","Dest Port":3000,"Proto":"TCP","Verdict":"ACCEPT"}
{"level":"info","ts":"2024-04-11T02:19:10.642Z","logger":"ebpf-client","caller":"ebpf/bpf_client.go:680","msg":"Updating Map with ","IP Key:":"xx.xxx.xxx.198/32"}
{"level":"info","ts":"2024-04-11T02:19:10.758Z","logger":"ebpf-client","caller":"ebpf/bpf_client.go:680","msg":"Updating Map with ","IP Key:":"xx.xxx.xxx.198/32"}
{"level":"info","ts":"2024-04-11T02:19:10.926Z","logger":"ebpf-client","caller":"ebpf/bpf_client.go:680","msg":"Updating Map with ","IP Key:":"xx.xxx.xxx.198/32"}
{"level":"info","ts":"2024-04-11T02:19:11.011Z","logger":"ebpf-client","caller":"ebpf/bpf_client.go:680","msg":"Updating Map with ","IP Key:":"xx.xxx.xxx.198/32"}
{"level":"info","ts":"2024-04-11T02:19:11.250Z","logger":"ebpf-client","caller":"ebpf/bpf_client.go:680","msg":"Updating Map with ","IP Key:":"xx.xxx.xxx.198/32"}
{"level":"info","ts":"2024-04-11T02:19:11.358Z","logger":"ebpf-client","caller":"ebpf/bpf_client.go:680","msg":"Updating Map with ","IP Key:":"xx.xxx.xxx.198/32"}
{"level":"info","ts":"2024-04-11T02:19:11.362Z","logger":"ebpf-client","msg":"Flow Info:  ","Src IP":"172.20.67.165","Src Port":80,"Dest IP":"xx.xxx.xxx.198","Dest Port":49032,"Proto":"TCP","Verdict":"DENY"}
{"level":"info","ts":"2024-04-11T02:19:19.431Z","logger":"ebpf-client","msg":"Flow Info:  ","Src IP":"xx.xxx.xxx.179","Src Port":56462,"Dest IP":"xx.xxx.xxx.198","Dest Port":3000,"Proto":"TCP","Verdict":"ACCEPT"}
{"level":"info","ts":"2024-04-11T02:19:29.430Z","logger":"ebpf-client","msg":"Flow Info:  ","Src IP":"xx.xxx.xxx.179","Src Port":42600,"Dest IP":"xx.xxx.xxx.198","Dest Port":3000,"Proto":"TCP","Verdict":"ACCEPT"}
{"level":"info","ts":"2024-04-11T02:19:38.242Z","logger":"ebpf-client","msg":"Flow Info:  ","Src IP":"172.20.67.165","Src Port":80,"Dest IP":"xx.xxx.xxx.198","Dest Port":49032,"Proto":"TCP","Verdict":"ACCEPT"}
{"level":"info","ts":"2024-04-11T02:19:38.247Z","logger":"ebpf-client","msg":"Flow Info:  ","Src IP":"xx.xxx.xxx.198","Src Port":42681,"Dest IP":"172.20.0.10","Dest Port":53,"Proto":"UDP","Verdict":"ACCEPT"}
{"level":"info","ts":"2024-04-11T02:19:38.249Z","logger":"ebpf-client","msg":"Flow Info:  ","Src IP":"xx.xxx.xxx.198","Src Port":47922,"Dest IP":"172.20.0.10","Dest Port":53,"Proto":"UDP","Verdict":"ACCEPT"}
{"level":"info","ts":"2024-04-11T02:19:38.249Z","logger":"ebpf-client","msg":"Flow Info:  ","Src IP":"xx.xxx.xxx.198","Src Port":57360,"Dest IP":"172.20.67.165","Dest Port":80,"Proto":"TCP","Verdict":"ACCEPT"}
{"level":"info","ts":"2024-04-11T02:19:39.431Z","logger":"ebpf-client","msg":"Flow Info:  ","Src IP":"xx.xxx.xxx.179","Src Port":37192,"Dest IP":"xx.xxx.xxx.198","Dest Port":3000,"Proto":"TCP","Verdict":"ACCEPT"}
{"level":"info","ts":"2024-04-11T02:19:39.431Z","logger":"ebpf-client","msg":"Flow Info:  ","Src IP":"xx.xxx.xxx.179","Src Port":37196,"Dest IP":"xx.xxx.xxx.198","Dest Port":3000,"Proto":"TCP","Verdict":"ACCEPT"}
```

**What you expected to happen**:

**How to reproduce it (as minimally and precisely as possible)**:

**Anything else we need to know?**:

**Environment**:
- Kubernetes version (use `kubectl version`): v1.26.12-eks-5e0fdde
- CNI Version: 
- OS (e.g: `cat /etc/os-release`): Amazon Linux release 2 (Karoo)
- Kernel (e.g. `uname -a`): 5.10.205-195.804.amzn2.x86_64
