### ISSUE TITLE
Support direct (i.e. Non SNAT) pod communications (Layer 4) via VPC peering, private gateways, etc when AWS_VPC_K8S_CNI_EXTERNALSNAT=false

### ISSUE THREAD

**Issue by pdzwart-atlassian** [aws/amazon-vpc-cni-k8s#474]
# 1. Scenario

When setting `AWS_VPC_K8S_CNI_EXTERNALSNAT=false` we have observed that Layer 4 datagrams (TCP sessions tested) are not forwarded to pods from sources outside of the subnets used by IPAM for pod IP allocations, but which are routable from these subnets (e.g. VPC peering/private gateways). As an illustration, imagine that an internal service needs to establish a TCP session with a pod all via RFC1918 IP addresses; but this pod also needs to interface with services out on the Internet and we prefer to do so via local SNAT on the instance that the pod is executing within.

When `AWS_VPC_K8S_CNI_EXTERNALSNAT=true`, the layer 4 datagrams are forwarded from these internal sources not directly in the configured subnets.

Being able to do so when `false` has the advantage that SNAT can be used through the instance's primary interface for connections external to the VPC and peering arrangements.

We suspect that this current behaviour may be by design given the following statement for the external SNAT configuration:

> Disable SNAT if you need to allow inbound communication to your pods from external VPNs, direct connections, and external VPCs, and your pods do not need to access the Internet directly via an Internet Gateway.

We haven't as yet been able to find where this behaviour would be controlled and have not been able to offer a PR as yet.

# 2. Test data

Kubernetes v1.13.5
aws-cni v1.4.0

## 2.1 Source host

```
$ ip addr show dev tun0|grep 'inet '
    inet 172.22.82.247/32 scope global tun0
```

## 2.2 Destination Pod

The Node and Pod IP below are for the `AWS_VPC_K8S_CNI_EXTERNALSNAT=false` test scenario.

### 2.2.1 K8S YAML

```
apiVersion: v1
kind: Pod
metadata:
  name: toolbox
  namespace: default
spec:
  containers:
  - name: toolbox
    image: …/toolbox:0.2
    ports:
      - containerPort: 8080
```

### 2.2.2 Node

```
$ kubectl get pod toolbox -o json | jq .spec.nodeName
"ip-10-7-5-49.ap-southeast-2.compute.internal"
```

### 2.2.3 Pod IP

```
$ kubectl get pod toolbox -o json | jq .status.podIP
"10.7.4.36"
```

```
root@toolbox:/# ifconfig eth0|grep 'inet '
        inet 10.7.4.36  netmask 255.255.255.255  broadcast 10.7.4.36
```

# 3. Tests

### 3.1.1 Source host to destination pod port

N.B. This is the scenario that we would prefer to work.

TCP SYN observed coming in correct interface on Node but not forwarded through to Pod:

```
$ telnet 10.7.4.36 8080
Trying 10.7.4.36...
telnet: Unable to connect to remote host: Connection timed out
--------------------------------------------------------------------------------
root@toolbox:/# tcpdump -n tcp port 8080
tcpdump: verbose output suppressed, use -v or -vv for full protocol decode
listening on eth0, link-type EN10MB (Ethernet), capture size 262144 bytes

--------------------------------------------------------------------------------
core@ip-10-7-4-143 ~ $ sudo tcpdump -i eth1 -n host 10.7.4.36 and tcp port 8080
dropped privs to tcpdump
tcpdump: verbose output suppressed, use -v or -vv for full protocol decode
listening on eth1, link-type EN10MB (Ethernet), capture size 262144 bytes
05:42:26.846699 IP 172.22.82.247.57346 > 10.7.4.36.8080: Flags [S], seq 1438058035, win 26200, options [mss 1310,sackOK,TS val 48314265 ecr 0,nop,wscale 7], length 0
05:42:27.865262 IP 172.22.82.247.57346 > 10.7.4.36.8080: Flags [S], seq 1438058035, win 26200, options [mss 1310,sackOK,TS val 48314520 ecr 0,nop,wscale 7], length 0
05:42:29.881948 IP 172.22.82.247.57346 > 10.7.4.36.8080: Flags [S], seq 1438058035, win 26200, options [mss 1310,sackOK,TS val 48315024 ecr 0,nop,wscale 7], length 0
05:42:33.916469 IP 172.22.82.247.57346 > 10.7.4.36.8080: Flags [S], seq 1438058035, win 26200, options [mss 1310,sackOK,TS val 48316032 ecr 0,nop,wscale 7], length 0
05:42:42.107779 IP 172.22.82.247.57346 > 10.7.4.36.8080: Flags [S], seq 1438058035, win 26200, options [mss 1310,sackOK,TS val 48318080 ecr 0,nop,wscale 7], length 0
05:42:58.236599 IP 172.22.82.247.57346 > 10.7.4.36.8080: Flags [S], seq 2126643362, win 26200, options [mss 1310,sackOK,TS val 48322112 ecr 0,nop,wscale 7], length 0
05:43:30.747672 IP 172.22.82.247.57346 > 10.7.4.36.8080: Flags [S], seq 1621414669, win 26200, options [mss 1310,sackOK,TS val 48330240 ecr 0,nop,wscale 7], length 0
```

### 3.1.2 Pod on same Node to destination pod port

TCP SYN observed forwarded to Pod and expected RST received:

```
root@xobloot:/# telnet 10.7.4.36 8080
Trying 10.7.4.36...
telnet: Unable to connect to remote host: Connection refused
root@xobloot:/# 
--------------------------------------------------------------------------------
root@toolbox:/# tcpdump -n tcp port 8080
tcpdump: verbose output suppressed, use -v or -vv for full protocol decode
listening on eth0, link-type EN10MB (Ethernet), capture size 262144 bytes
05:46:12.249278 IP 10.7.4.34.49718 > 10.7.4.36.8080: Flags [S], seq 2031225882, win 26883, options [mss 8961,sackOK,TS val 1492001046 ecr 0,nop,wscale 12], length 0
05:46:12.249313 IP 10.7.4.36.8080 > 10.7.4.34.49718: Flags [R.], seq 0, ack 2031225883, win 0, length 0
```

### 3.1.3 Pod on different Node to destination pod port

TCP SYN observed coming in correct interface and forwarded to Pod and expected RST received:

```
$ kubectl get pod xobloot-deployment-6d6c5cc88b-mhsrn -o json | jq .spec.nodeName                                                                                                           
"ip-10-7-1-229.ap-southeast-2.compute.internal"
$ kubectl exec -t xobloot-deployment-6d6c5cc88b-mhsrn telnet 10.7.4.36 8080
Trying 10.7.4.36...
telnet: Unable to connect to remote host: Connection refused
command terminated with exit code 1
$ 
--------------------------------------------------------------------------------
root@toolbox:/# tcpdump -n tcp port 8080
tcpdump: verbose output suppressed, use -v or -vv for full protocol decode
listening on eth0, link-type EN10MB (Ethernet), capture size 262144 bytes
05:51:30.711971 IP 10.7.3.98.41482 > 10.7.4.36.8080: Flags [S], seq 3777137978, win 26883, options [mss 8961,sackOK,TS val 451168418 ecr 0,nop,wscale 12], length 0
05:51:30.712107 IP 10.7.4.36.8080 > 10.7.3.98.41482: Flags [R.], seq 0, ack 3777137979, win 0, length 0
--------------------------------------------------------------------------------
core@ip-10-7-4-143 ~ $ sudo tcpdump -i eth1 -n host 10.7.4.36 and tcp port 8080
dropped privs to tcpdump
tcpdump: verbose output suppressed, use -v or -vv for full protocol decode
listening on eth1, link-type EN10MB (Ethernet), capture size 262144 bytes
05:51:30.711878 IP 10.7.3.98.41482 > 10.7.4.36.8080: Flags [S], seq 3777137978, win 26883, options [mss 8961,sackOK,TS val 451168418 ecr 0,nop,wscale 12], length 0
05:51:30.712141 IP 10.7.4.36.8080 > 10.7.3.98.41482: Flags [R.], seq 0, ack 3777137979, win 0, length 0
```

## 3.2 `AWS_VPC_K8S_CNI_EXTERNALSNAT=true`

N.B. New pod & node for the test `toolbox`.

### 3.2.1 Source host to destination pod port

TCP SYN obseved forwarded to pod and expected RST received:

```
$ telnet 10.7.4.128 8080
Trying 10.7.4.128...
telnet: Unable to connect to remote host: Connection refused
$ 
--------------------------------------------------------------------------------
root@toolbox:/# tcpdump -n tcp port 8080
tcpdump: verbose output suppressed, use -v or -vv for full protocol decode
listening on eth0, link-type EN10MB (Ethernet), capture size 262144 bytes
06:48:59.420737 IP 172.22.82.247.34378 > 10.7.4.128.8080: Flags [S], seq 3055963806, win 26200, options [mss 1310,sackOK,TS val 49312406 ecr 0,nop,wscale 7], length 0
06:48:59.420755 IP 10.7.4.128.8080 > 172.22.82.247.34378: Flags [R.], seq 0, ack 3055963807, win 0, length 0

```

**Comment by mogren** [comment]
`AWS_VPC_K8S_CNI_EXCLUDE_SNAT_CIDRS` was added in #520 as a way to include peered VPC CIDRs.
