### ISSUE TITLE
after a node joins EKS cluster, cannot ping its second ENI's ip from peer vpc

### ISSUE THREAD

**Issue by nasuku** [aws/amazon-vpc-cni-k8s#1327]
I have VPC peering (and corresponding route tables/security groups setup correctly) between 2 regions.
When I bring up a vanilla ec2 instance, i can ping both its ENI from the peer vpc.
once I make the node join a EKS cluster, I can only ping the primary ENI. The ping to second ENI fails from vpc peer.

I tried with both       
AWS_VPC_K8S_CNI_EXTERNALSNAT:        true  
and 
AWS_VPC_K8S_CNI_EXTERNALSNAT:        false

I tried both disabling the 'Source/Dest check' on both the ENIs attached to the VM.

**What happened**:
I observed that ping packets are coming in on eth1 and there was no reply.

Only after I configured
 sysctl net.ipv4.conf.all.rp_filter=2
I see that packets were being sent out of the VM.

Unfortunately - the packets are not reaching the other side of vpc peer.
(for some reason, the packets go through fine if pinging from the same region - even from a different subnet).

**Attach logs**
[eks_i-02dc52684302e928d_2020-12-12_1836-UTC_0.6.2.tar.gz](https://github.com/aws/amazon-vpc-cni-k8s/files/5683622/eks_i-02dc52684302e928d_2020-12-12_1836-UTC_0.6.2.tar.gz)

**What you expected to happen**:
The ping to host on both the host interfaces should continue to work.

**How to reproduce it (as minimally and precisely as possible)**:
bring up a EKS in a vpc.
setup a peering connecting to another vpc.
Add the routes for the remote vpc through the vpc peering connection. (do it on both sides of peering connection).
From some vm on the remote peer, try pinging both the ENI of a VM.

**Anything else we need to know?**:
The same observation holds true if I try to ping any POD whose IP is attached to the second ENI. If the pod is attached to the primary ENI, I am able to connect it from vpc peer.

Also, if you have any suggestions  to enable  communication with pods directly from vpc peer (irrespective of which ENI they are attached to), that will be very helpful.

**Environment**:
- Kubernetes version (use `kubectl version`):
1.18
- CNI Version
0.3.1 (from /etc/cni/net.d/10-aws.conflist)
- OS (e.g: `cat /etc/os-release`):
PRETTY_NAME="Amazon Linux 2"
- Kernel (e.g. `uname -a`):
4.14.203-156.332.amzn2.x86_64
AMI ID:
ami-0af965363397f19f5

**Comment by jayanthvn** [comment]
Hi @nasuku 

Nice to hear from you :). We will try repro and get back to you. Based on your description ping should work, can you also please check if security groups are not blocking for secondary ENIs?

Thanks!

**Comment by nasuku** [comment]
Hi @jayanthvn  - Security groups are fine.

**Comment by nithu0115** [comment]
Hi @nasuku, I tried replicating the issue but failed to do it. I have 2 VPCs in the same region and in the same account which are peered, and I am able to ping the Pod IP from the peered VPC. 

Note: for this work, I had to disable external SNAT (AWS_VPC_K8S_CNI_EXTERNALSNAT: true) 

```
[ec2-user@ip-10-0-1-130 ~]$ ping 192.168.41.133
PING 192.168.41.133 (192.168.41.133) 56(84) bytes of data.
64 bytes from 192.168.41.133: icmp_seq=1 ttl=254 time=0.394 ms
64 bytes from 192.168.41.133: icmp_seq=2 ttl=254 time=0.526 ms
64 bytes from 192.168.41.133: icmp_seq=3 ttl=254 time=0.385 ms
64 bytes from 192.168.41.133: icmp_seq=4 ttl=254 time=0.414 ms
64 bytes from 192.168.41.133: icmp_seq=5 ttl=254 time=0.424 ms
64 bytes from 192.168.41.133: icmp_seq=6 ttl=254 time=0.410 ms
64 bytes from 192.168.41.133: icmp_seq=7 ttl=254 time=0.381 ms
64 bytes from 192.168.41.133: icmp_seq=8 ttl=254 time=0.420 ms
64 bytes from 192.168.41.133: icmp_seq=9 ttl=254 time=0.437 ms
64 bytes from 192.168.41.133: icmp_seq=10 ttl=254 time=0.544 ms
64 bytes from 192.168.41.133: icmp_seq=11 ttl=254 time=0.407 ms
64 bytes from 192.168.41.133: icmp_seq=12 ttl=254 time=0.432 ms
64 bytes from 192.168.41.133: icmp_seq=13 ttl=254 time=0.434 ms
64 bytes from 192.168.41.133: icmp_seq=14 ttl=254 time=0.450 ms
64 bytes from 192.168.41.133: icmp_seq=15 ttl=254 time=0.422 ms
64 bytes from 192.168.41.133: icmp_seq=16 ttl=254 time=0.415 ms
64 bytes from 192.168.41.133: icmp_seq=17 ttl=254 time=0.439 ms
64 bytes from 192.168.41.133: icmp_seq=18 ttl=254 time=0.452 ms
64 bytes from 192.168.41.133: icmp_seq=19 ttl=254 time=0.377 ms
^C
--- 192.168.41.133 ping statistics ---
19 packets transmitted, 19 received, 0% packet loss, time 18426ms
rtt min/avg/max/mdev = 0.377/0.429/0.544/0.047 ms
```

```
ec2-user@ip-192-168-45-231 ~]$ sudo tcpdump -i eth2 host 10.0.1.130
tcpdump: verbose output suppressed, use -v or -vv for full protocol decode
listening on eth2, link-type EN10MB (Ethernet), capture size 262144 bytes
18:42:55.157567 IP ip-10-0-1-130.us-west-2.compute.internal > ip-192-168-41-133.us-west-2.compute.internal: ICMP echo request, id 4192, seq 17, length 64
18:42:55.157643 IP ip-192-168-41-133.us-west-2.compute.internal > ip-10-0-1-130.us-west-2.compute.internal: ICMP echo reply, id 4192, seq 17, length 64
18:42:56.181572 IP ip-10-0-1-130.us-west-2.compute.internal > ip-192-168-41-133.us-west-2.compute.internal: ICMP echo request, id 4192, seq 18, length 64
18:42:56.181649 IP ip-192-168-41-133.us-west-2.compute.internal > ip-10-0-1-130.us-west-2.compute.internal: ICMP echo reply, id 4192, seq 18, length 64
^C
```

Could you provide me the EC2 instance ID of the source and the Pod IP of the target? Also, could you collect tcpdump on the target (worker node) instance and see if the packet is arriving on the target?

**Comment by nasuku** [comment]
hi @nithu0115  - When I set AWS_VPC_K8S_CNI_EXTERNALSNAT: true, the ping to second ENI still fails. (In this case, the ping to the pods attached to the second ENI are working).

Please note as I indicated earlier, by default the replies are not being sent by vm.
Only after I set  sysctl net.ipv4.conf.all.rp_filter=2, then I see replies going out of eth0 (not via eth1 on which requests came in).

I am pinging i-0c2618ba1cc317797 from (eni-0b226e8801499c569) via the peering connection pcx-0170ca98a86f5b389 and thats failing.

**Comment by jayanthvn** [comment]
Hi Suresh,

Are you still seeing this issue? Can you please share your clusterARNs and the 2 instance ids? You can email it to me - varavaj@amazon.com

Thanks!

**Comment by jayanthvn** [comment]
Hi Suresh,

We received the information and will get back to you this week.

**Comment by YYSU** [comment]
+1 same issue

**Comment by YYSU** [comment]
+1 for same issue.

At first I thought this issue was related to SNAT, so I tried to turn off/on SNAT, but the situation was still the same. My instance had two ENIs, only the primary ip of the secondary ENI can not be pinged All other IPs in sec ENI will respond to ping. The other IPs in sec ENI will respond to ping.

**Comment by jayanthvn** [comment]
Sorry for the delay we are looking into it. Will update the thread soon.

**Comment by oniGino** [comment]
+1 same issue 
primary IP will response to ICMP fine, secondary IPs do not respond

for me 
`sysctl net.ipv4.conf.all.rp_filter=2` 

does not cleanly resolve the issue because ICMP responses come from the wrong source IP after the change
(in the below primary node ip is 10.14.12.68 but secondary is 10.14.12.7) (I am 10.11.254.107)
see output 
```
#ping 10.14.12.7                                                                                                                                                     
PING 10.14.12.7 (10.14.12.7): 56 data bytes
Request timeout for icmp_seq 0
Request timeout for icmp_seq 1
Request timeout for icmp_seq 2
92 bytes from 10.14.12.68: Destination Host Unreachable
Vr HL TOS  Len   ID Flg  off TTL Pro  cks      Src      Dst
 4  5  00 5400 c2de   0 0000  3b  01 9e3f 10.11.254.107  10.14.12.7

92 bytes from 10.14.12.68: Destination Host Unreachable
Vr HL TOS  Len   ID Flg  off TTL Pro  cks      Src      Dst
 4  5  00 5400 3118   0 0000  3b  01 3006 10.11.254.107  10.14.12.7

92 bytes from 10.14.12.68: Destination Host Unreachable
Vr HL TOS  Len   ID Flg  off TTL Pro  cks      Src      Dst
 4  5  00 5400 36cd   0 0000  3b  01 2a51 10.11.254.107  10.14.12.7

92 bytes from 10.14.12.68: Destination Host Unreachable
Vr HL TOS  Len   ID Flg  off TTL Pro  cks      Src      Dst
 4  5  00 5400 3d41   0 0000  3b  01 23dd 10.11.254.107  10.14.12.7

Request timeout for icmp_seq 3
Request timeout for icmp_seq 4
Request timeout for icmp_seq 5
Request timeout for icmp_seq 6
92 bytes from 10.14.12.68: Destination Host Unreachable
Vr HL TOS  Len   ID Flg  off TTL Pro  cks      Src      Dst
 4  5  00 5400 407a   0 0000  3b  01 20a4 10.11.254.107  10.14.12.7

92 bytes from 10.14.12.68: Destination Host Unreachable
Vr HL TOS  Len   ID Flg  off TTL Pro  cks      Src      Dst
 4  5  00 5400 852b   0 0000  3b  01 dbf2 10.11.254.107  10.14.12.7

92 bytes from 10.14.12.68: Destination Host Unreachable
Vr HL TOS  Len   ID Flg  off TTL Pro  cks      Src      Dst
 4  5  00 5400 1cc7   0 0000  3b  01 4457 10.11.254.107  10.14.12.7

92 bytes from 10.14.12.68: Destination Host Unreachable
Vr HL TOS  Len   ID Flg  off TTL Pro  cks      Src      Dst
 4  5  00 5400 2503   0 0000  3b  01 3c1b 10.11.254.107  10.14.12.7

Request timeout for icmp_seq 7
Request timeout for icmp_seq 8
```

**Comment by nithu0115** [comment]
@nasuku @oniGino @YYSU I did some further testing this weekend and I learned that we don't add routes for the primary IPs of the secondary ENIs which are attached to the EC2 instances by amazon-vpc-cni-k8s CNI. This is a design choice we made, where we do not assign the primary IP of secondary interfaces to the Pod. 

To fix the issue, we will have setup route manually: 

```
eth1=<primary IP of the secondary interface>
ip route add 192.168.128.0/19 dev eth1 table 10001 proto kernel scope link src $eth1
ip route add default via 192.168.128.1 dev eth1 table 10001
ip rule add from $eth1 lookup 10001 pref 32765
```

**Comment by jayanthvn** [comment]
@nasuku - If you need, I do have a script which will set up these static routes. I can share it with you.

**Comment by oniGino** [comment]
@nithu0115 my only conflict was our IPAM system that handles provisions would sometimes have ip collisions in the ec2 api. Mainly because IP usage was being tracked via ICMP

our work around is to move all eks node groups to dedicated EKS subnets

seems to fix the main issue

**Comment by nasuku** [comment]
We modified our code to use the primary ENI only and hence this is no longer a needed use case for me.
Please feel free to close this issue if you dont plan to make any changes.

**Comment by jayanthvn** [comment]
Thanks Suresh.

**Comment by mariadb-SumedhWale** [comment]
@jayanthvn We are having a similar issue with secondary ENIs not being routable from outside using Elastic IPs.

Our use-case is pretty simple: we have no use of a LoadBalancer and even if required the nginx container will take care of it. This allows us to reduce the unnecessary cost of a LoadBalancer. Routing to services within is handled by this container (so effectively is a custom Ingress controller), so in initContainers it simply associates a configured Elastic IP with the node where the pod got scheduled. Then it updates the externalIPs of the nginx service to point to the private IP of the node.

This works well when the Elastic IP is assigned the primary ENI. But that has a problem that if the pod gets rescheduled to another node then the disassociation of the Elastic IP from the previous node causes it to have no public IP since its auto-assigned public IP was overwritten by Elastic IP and a new one never gets allocated. So unless another Elastic IP is assigned to the old node it will go into NotReady state.

A simple solution to this was to use the secondary ENI created by eks instead of the primary but it lacks required routing rules. Manually running the commands mentioned in https://github.com/aws/amazon-vpc-cni-k8s/issues/1327#issuecomment-771149810 for the subnet allows it to work correctly.

Do you have a script to do the same? Should that be added to user data in launch template or somewhere else? I can write a generic script as part of user data but it looked pretty messy to me (starting with the fact that it takes a while for eth1 to show up). If you have a better solution in mind for this then please let me know.

**Comment by mariadb-SumedhWale** [comment]
Update on this: I gave up on using secondary ENIs for the elastic IPs which caused some trouble or other. Now using primary ENIs with the pod startup script taking care of assigning a new elastic IP to the previous node in case the deployment relocates the pod to another node (else the previous node will get kicked out from EKS cluster). Also added a CronJob to clean up unallocated elastic IPs in the cluster.
