### ISSUE TITLE
Pod connectivity fails on certain kube-nodes

### ISSUE THREAD

**Issue by xrl** [aws/amazon-vpc-cni-k8s#180]
I am using Kops and the aws-vpc-cni version 1.1. I have 3 masters and 3 kube-nodes. 2 of those kube-nodes schedule pods but those pods cannot reach the kube-dns using the internal IP nor can they route traffic to the kube internal API (kubernetes.default.svc).

I can force pods to be scheduled on the unhealthy nodes by cordoning off the 1 healthy node.

The image I'm talking about is an `ubuntu:bionic`, with the proper `/etc/resolv.conf` in place with the expected search paths:

```
# cat /etc/resolv.conf
nameserver 10.43.168.10
search monitoring.svc.cluster.local svc.cluster.local cluster.local ec2.internal
options ndots:5
```

which lines up with the IP of DNS:

```
$ k -n kube-system get svc
NAME             TYPE        CLUSTER-IP     EXTERNAL-IP   PORT(S)         AGE
kube-dns         ClusterIP   10.43.168.10   <none>        53/UDP,53/TCP   8d
kubelet          ClusterIP   None           <none>        10250/TCP       3d
metrics-server   ClusterIP   10.43.168.22   <none>        443/TCP         7d
$ k -n default get svc
NAME         TYPE        CLUSTER-IP    EXTERNAL-IP   PORT(S)   AGE
kubernetes   ClusterIP   10.43.168.1   <none>        443/TCP   8d
```

then when I hop on the pod, dns is busted:

```
# dig archive.ubuntu.com

; <<>> DiG 9.11.3-1ubuntu1.2-Ubuntu <<>> archive.ubuntu.com
;; global options: +cmd
;; connection timed out; no servers could be reached
```

or

```
# dig kubernetes.default.svc

; <<>> DiG 9.11.3-1ubuntu1.2-Ubuntu <<>> kubernetes.default.svc
;; global options: +cmd
;; connection timed out; no servers could be reached
```

and connectivity by IP is also broken, here I try to curl the kubernetes API:

```
# curl -vk https://10.43.168.1
* Rebuilt URL to: https://10.43.168.1/
*   Trying 10.43.168.1...
* TCP_NODELAY set
[[[ SNIP: just hangs ]]]
```

all these things can be done from pods on the healthy node. Something is wrong with the network configuration on these unhealthy pods and I don't know how to debug it. The cni-metrics-helper looks healthy for 6 total ec2 hosts (3 of them masters):

```
I0922 00:55:47.881139       7 metrics.go:250] Processing metric: ipamd_action_inprogress
I0922 00:55:47.881141       7 metrics.go:92] Label: [name:"fn" value:"nodeIPPoolReconcile" ], Value: 0
I0922 00:55:47.881146       7 metrics.go:92] Label: [name:"fn" value:"nodeInit" ], Value: 0
I0922 00:55:47.881149       7 metrics.go:92] Label: [name:"fn" value:"retryAllocENIIP" ], Value: 0
I0922 00:55:47.881153       7 metrics.go:250] Processing metric: assigned_ip_addresses
I0922 00:55:47.881156       7 metrics.go:250] Processing metric: total_ip_addresses
I0922 00:55:47.881160       7 metrics.go:404] Grab/Aggregate metrics from aws-node-tj4ps
I0922 00:55:47.881163       7 cni_metrics.go:99] Grabbing metrics from CNI aws-node-tj4ps
I0922 00:55:47.886288       7 metrics.go:250] Processing metric: assigned_ip_addresses
I0922 00:55:47.886298       7 metrics.go:250] Processing metric: total_ip_addresses
I0922 00:55:47.886300       7 metrics.go:250] Processing metric: eni_allocated
I0922 00:55:47.886302       7 metrics.go:250] Processing metric: ipamd_action_inprogress
I0922 00:55:47.886305       7 metrics.go:92] Label: [name:"fn" value:"nodeIPPoolReconcile" ], Value: 0
I0922 00:55:47.886315       7 metrics.go:92] Label: [name:"fn" value:"nodeInit" ], Value: 0
I0922 00:55:47.886319       7 metrics.go:92] Label: [name:"fn" value:"retryAllocENIIP" ], Value: 0
I0922 00:55:47.886324       7 metrics.go:250] Processing metric: eni_max
I0922 00:55:47.886327       7 metrics.go:250] Processing metric: ipamd_error_count
I0922 00:55:47.886329       7 metrics.go:101] Label: [name:"error" value:"unable to get local pods, giving up"  name:"fn" value:"nodeInitK8SGetLocalPodIPsFailed" ], Value: 1
I0922 00:55:47.886339       7 metrics.go:350] Produce GAUGE metrics: assignIPAddresses, value: 17.000000
I0922 00:55:47.886343       7 metrics.go:350] Produce GAUGE metrics: totalIPAddresses, value: 228.000000
I0922 00:55:47.886346       7 metrics.go:350] Produce GAUGE metrics: eniAllocated, value: 12.000000
I0922 00:55:47.886351       7 metrics.go:350] Produce GAUGE metrics: ipamdActionInProgress, value: 0.000000
I0922 00:55:47.886353       7 metrics.go:350] Produce GAUGE metrics: eniMaxAvailable, value: 33.000000
I0922 00:55:47.886356       7 metrics.go:340] Produce COUNTER metrics: ipamdErr, value: 0.000000
```

and I don't see anything in particular on the kube logs of the aws-vpc-cni daemonset pod running on the unhealthy nodes, for example:

```
$ k -n kube-system logs aws-node-c66nn --tail=100
=====Starting installing AWS-CNI =========
=====Starting amazon-k8s-agent ===========
ERROR: logging before flag.Parse: W0917 22:32:02.326125      11 client_config.go:533] Neither --kubeconfig nor --master was specified.  Using the inClusterConfig.  This might not work.
[[[ end of logs ]]]
```

**Comment by derekssmith** [comment]
I am having this exact same issue.  Did you find a resolution?

**Comment by xrl** [comment]
I am trying a test now where I delete those ec2 instances and let the kops-configured autoscaling group replace them with fresh hosts.

I should have left one of the unhealthy kube-nodes alone and tried it out on just one so I could figure out what was different. But ah well, next time. Now my pods work again.

It should not require a kube-node replacement to get the aws-vpc-cni to work. No reported errors from what I can tell.

**Comment by xrl** [comment]
@derekssmith I would not describe my resolution as a good one. I don't even have a solid error from any one component, just pod connections failing. Have you found any definitive errors in aws-vpc-cni or on a kube-node's systemctl or journalctl logs?

**Comment by derekssmith** [comment]
@xrl I ended up figuring out my problem.  I created two separate cloud formation stacks for different sized worker nodes.  This resulted in two sets of nodes that could communicate with the nodes in the same stack, and the control plane, but they could not cross communicate.  I fixed this by adding new inbound rules to their security groups.  I had to allow all traffic to the other set of nodes on each.

Hope this helps.

**Comment by xrl** [comment]
I also see this in my kube events:

```
default         4m        4d        36521     ip-10-43-169-201.ec2.internal.15554f0d6a9c1ceb       Node                                          Normal    CIDRNotAvailable           cidrAllocator                            Node ip-10-43-169-201.ec2.internal status is now: CIDRNotAvailable
default         39s       2h        932       ip-10-43-171-84.ec2.internal.155693654f2aa410        Node                                          Normal    CIDRNotAvailable           cidrAllocator                            Node ip-10-43-171-84.ec2.internal status is now: CIDRNotAvailable
```

which seems suspect.

**Comment by jlory** [comment]
I had the same issue today, I think it's a networking amazon-vpc-cni-k8s + ENI + VIPs issue, when I did a tcpdump on the VM that was running kube-dns I saw that:

```
17:25:22.943704 IP 10.29.56.21.51669 > 10.29.56.125.53: 57018+ AAAA? istio-pilot.istio-system.default.svc.cluster.local. (68)
17:25:24.284723 IP 10.29.56.217.43506 > 10.29.56.125.53: 54786+ [1au] A? google.com. (39)
17:25:25.224659 IP 10.29.56.220.36503 > 10.29.56.125.53: 26970+ A? istio-telemetry.istio-system.svc.cluster.local. (64)
17:25:25.505226 IP 10.29.56.217.34886 > 10.29.56.125.53: 11861+ AAAA? istio-pilot.istio-system.svc.cluster.local. (60)
17:25:25.760252 IP 10.29.56.21.51669 > 10.29.56.125.53: 57018+ AAAA? istio-pilot.istio-system.default.svc.cluster.local. (68)
17:25:25.895041 IP 10.29.56.144.50867 > 10.29.56.125.53: 49746+ A? zipkin.istio-system.default.svc.cluster.local. (63)
```

As you can see traffic comes in but then no answer, all pods on the same VM woudn't work anymore.

**Comment by conversicachrisr** [comment]
I believe we are also experiencing this issue. I've tried v1.1.0 and v1.2.1. On EKSv2, m5d.12xl.

We have pods that (on create) are permanently unreachable, all connections to them will time out from both external (into the cluster via pod ip) and internal (from another pod, in the same namespace, or even same node).
They are added to the service and are listed under endpoints.
They pass their ready checks and live checks.
It's seemingly random.
We've had this occur on system and user pods.
We've only had this occur at scale, say >40 pods per node.
Killing the pod and letting it get replaced usually resolves the issue.
This issue occurs on all (3) nodes in our cluster, it is not node specific and it is not scoped to a node when it does impact pods.
When running 1.1.0 we saw up to 40 pods out of 200 enter this state.
When running 1.2.1 we have only seen about 10 out of 200 pods enter this state.
I've been unable to reproduce this issue with an identical cluster configuration on a smaller sized test cluster, this has only occurred at scale.
Initial checks of the debugging output looks fine but I can provide this to someone upon request.

**Comment by mogren** [comment]
Moved to #204
